<?xml version="1.0"?><!DOCTYPE trace SYSTEM "logTPF.dtd">
<trace>
<msg>Master 27351 running on http://localhost:5000/.</msg>
<msg>Worker 27357 running on http://localhost:5000/.</msg>
<entry id="e27357-1" client="::ffff:127.0.0.1" worker="27357" time="2017-04-25T18:16:34.630Z">
<s type="var"/><p type="var"/><o type="var"/>
</entry>
<data-triple-N3 id="e27357-1"><s type="iri" val="http://dbpedia.org/resource/!"/><p type="iri" val="http://dbpedia.org/ontology/wikiPageID"/><o type="lit"><![CDATA["5878274"^^http://www.w3.org/2001/XMLSchema#integer]]></o></data-triple-N3>

<data-triple-N3 id="e27357-1"><s type="iri" val="http://dbpedia.org/resource/!"/><p type="iri" val="http://dbpedia.org/ontology/wikiPageRedirects"/><o type="iri" val="http://dbpedia.org/resource/Exclamation_mark"/></data-triple-N3>

<data-triple-N3 id="e27357-1"><s type="iri" val="http://dbpedia.org/resource/!"/><p type="iri" val="http://dbpedia.org/ontology/wikiPageRedirects"/><o type="iri" val="http://dbpedia.org/resource/Exclamation_mark"/></data-triple-N3>

<data-triple-N3 id="e27357-1"><s type="iri" val="http://dbpedia.org/resource/!"/><p type="iri" val="http://dbpedia.org/ontology/wikiPageRevisionID"/><o type="lit"><![CDATA["489132637"^^http://www.w3.org/2001/XMLSchema#integer]]></o></data-triple-N3>

<data-triple-N3 id="e27357-1"><s type="iri" val="http://dbpedia.org/resource/!"/><p type="iri" val="http://dbpedia.org/ontology/wikiPageWikiLink"/><o type="iri" val="http://dbpedia.org/resource/Exclamation_mark"/></data-triple-N3>

<data-triple-N3 id="e27357-1"><s type="iri" val="http://dbpedia.org/resource/!"/><p type="iri" val="http://www.w3.org/2000/01/rdf-schema#label"/><o type="lit"><![CDATA["!"@en]]></o></data-triple-N3>

<data-triple-N3 id="e27357-1"><s type="iri" val="http://dbpedia.org/resource/!"/><p type="iri" val="http://www.w3.org/ns/prov#wasDerivedFrom"/><o type="iri" val="http://en.wikipedia.org/wiki/!?oldid=489132637"/></data-triple-N3>

<data-triple-N3 id="e27357-1"><s type="iri" val="http://dbpedia.org/resource/!"/><p type="iri" val="http://xmlns.com/foaf/0.1/isPrimaryTopicOf"/><o type="iri" val="http://en.wikipedia.org/wiki/!"/></data-triple-N3>

<data-triple-N3 id="e27357-1"><s type="iri" val="http://dbpedia.org/resource/!!"/><p type="iri" val="http://dbpedia.org/ontology/wikiPageDisambiguates"/><o type="iri" val="http://dbpedia.org/resource/!!!"/></data-triple-N3>

<data-triple-N3 id="e27357-1"><s type="iri" val="http://dbpedia.org/resource/!!"/><p type="iri" val="http://dbpedia.org/ontology/wikiPageDisambiguates"/><o type="iri" val="http://dbpedia.org/resource/!!!"/></data-triple-N3>

<data-triple-N3 id="e27357-1"><s type="iri" val="http://dbpedia.org/resource/!!"/><p type="iri" val="http://dbpedia.org/ontology/wikiPageID"/><o type="lit"><![CDATA["3632887"^^http://www.w3.org/2001/XMLSchema#integer]]></o></data-triple-N3>

<data-triple-N3 id="e27357-1"><s type="iri" val="http://dbpedia.org/resource/!!"/><p type="iri" val="http://dbpedia.org/ontology/wikiPageRevisionID"/><o type="lit"><![CDATA["545017937"^^http://www.w3.org/2001/XMLSchema#integer]]></o></data-triple-N3>

<data-triple-N3 id="e27357-1"><s type="iri" val="http://dbpedia.org/resource/!!"/><p type="iri" val="http://dbpedia.org/ontology/wikiPageWikiLink"/><o type="iri" val="http://dbpedia.org/resource/!!!"/></data-triple-N3>

<data-triple-N3 id="e27357-1"><s type="iri" val="http://dbpedia.org/resource/!!"/><p type="iri" val="http://dbpedia.org/ontology/wikiPageWikiLink"/><o type="iri" val="http://dbpedia.org/resource/!!!"/></data-triple-N3>

<data-triple-N3 id="e27357-1"><s type="iri" val="http://dbpedia.org/resource/!!"/><p type="iri" val="http://dbpedia.org/ontology/wikiPageWikiLink"/><o type="iri" val="http://dbpedia.org/resource/!_(disambiguation)"/></data-triple-N3>

<data-triple-N3 id="e27357-1"><s type="iri" val="http://dbpedia.org/resource/!!"/><p type="iri" val="http://dbpedia.org/ontology/wikiPageWikiLink"/><o type="iri" val="http://dbpedia.org/resource/!_(disambiguation)"/></data-triple-N3>

<data-triple-N3 id="e27357-1"><s type="iri" val="http://dbpedia.org/resource/!!"/><p type="iri" val="http://dbpedia.org/ontology/wikiPageWikiLink"/><o type="iri" val="http://dbpedia.org/resource/Boolean_data_type"/></data-triple-N3>

<data-triple-N3 id="e27357-1"><s type="iri" val="http://dbpedia.org/resource/!!"/><p type="iri" val="http://dbpedia.org/ontology/wikiPageWikiLink"/><o type="iri" val="http://dbpedia.org/resource/Boolean_data_type"/></data-triple-N3>

<data-triple-N3 id="e27357-1"><s type="iri" val="http://dbpedia.org/resource/!!"/><p type="iri" val="http://dbpedia.org/ontology/wikiPageWikiLink"/><o type="iri" val="http://dbpedia.org/resource/Chess_annotation_symbols"/></data-triple-N3>

<data-triple-N3 id="e27357-1"><s type="iri" val="http://dbpedia.org/resource/!!"/><p type="iri" val="http://dbpedia.org/ontology/wikiPageWikiLink"/><o type="iri" val="http://dbpedia.org/resource/Chess_annotation_symbols"/></data-triple-N3>

<data-triple-N3 id="e27357-1"><s type="iri" val="http://dbpedia.org/resource/!!"/><p type="iri" val="http://dbpedia.org/ontology/wikiPageWikiLink"/><o type="iri" val="http://dbpedia.org/resource/Double_factorial"/></data-triple-N3>

<data-triple-N3 id="e27357-1"><s type="iri" val="http://dbpedia.org/resource/!!"/><p type="iri" val="http://dbpedia.org/ontology/wikiPageWikiLink"/><o type="iri" val="http://dbpedia.org/resource/Double_factorial"/></data-triple-N3>

<data-triple-N3 id="e27357-1"><s type="iri" val="http://dbpedia.org/resource/!!"/><p type="iri" val="http://dbpedia.org/ontology/wikiPageWikiLink"/><o type="iri" val="http://dbpedia.org/resource/Double_negative"/></data-triple-N3>

<data-triple-N3 id="e27357-1"><s type="iri" val="http://dbpedia.org/resource/!!"/><p type="iri" val="http://dbpedia.org/ontology/wikiPageWikiLink"/><o type="iri" val="http://dbpedia.org/resource/Double_negative"/></data-triple-N3>

<data-triple-N3 id="e27357-1"><s type="iri" val="http://dbpedia.org/resource/!!"/><p type="iri" val="http://dbpedia.org/ontology/wikiPageWikiLink"/><o type="iri" val="http://dbpedia.org/resource/Exclamation_mark"/></data-triple-N3>

<data-triple-N3 id="e27357-1"><s type="iri" val="http://dbpedia.org/resource/!!"/><p type="iri" val="http://dbpedia.org/ontology/wikiPageWikiLink"/><o type="iri" val="http://dbpedia.org/resource/Exclamation_mark"/></data-triple-N3>

<data-triple-N3 id="e27357-1"><s type="iri" val="http://dbpedia.org/resource/!!"/><p type="iri" val="http://dbpedia.org/ontology/wikiPageWikiLink"/><o type="iri" val="http://dbpedia.org/resource/Haskell_(programming_language)"/></data-triple-N3>

<data-triple-N3 id="e27357-1"><s type="iri" val="http://dbpedia.org/resource/!!"/><p type="iri" val="http://dbpedia.org/ontology/wikiPageWikiLink"/><o type="iri" val="http://dbpedia.org/resource/Haskell_(programming_language)"/></data-triple-N3>

<data-triple-N3 id="e27357-1"><s type="iri" val="http://dbpedia.org/resource/!!"/><p type="iri" val="http://dbpedia.org/ontology/wikiPageWikiLink"/><o type="iri" val="http://dbpedia.org/resource/Retroflex_clicks"/></data-triple-N3>

<data-triple-N3 id="e27357-1"><s type="iri" val="http://dbpedia.org/resource/!!"/><p type="iri" val="http://dbpedia.org/ontology/wikiPageWikiLink"/><o type="iri" val="http://dbpedia.org/resource/Retroflex_clicks"/></data-triple-N3>

<data-triple-N3 id="e27357-1"><s type="iri" val="http://dbpedia.org/resource/!!"/><p type="iri" val="http://www.w3.org/2000/01/rdf-schema#label"/><o type="lit"><![CDATA["!!"@en]]></o></data-triple-N3>

<data-triple-N3 id="e27357-1"><s type="iri" val="http://dbpedia.org/resource/!!"/><p type="iri" val="http://www.w3.org/2002/07/owl#sameAs"/><o type="iri" val="http://de.dbpedia.org/resource/Doppeltes_Ausrufezeichen"/></data-triple-N3>

<data-triple-N3 id="e27357-1"><s type="iri" val="http://dbpedia.org/resource/!!"/><p type="iri" val="http://www.w3.org/2002/07/owl#sameAs"/><o type="iri" val="http://eo.dbpedia.org/resource/!!"/></data-triple-N3>

<data-triple-N3 id="e27357-1"><s type="iri" val="http://dbpedia.org/resource/!!"/><p type="iri" val="http://www.w3.org/2002/07/owl#sameAs"/><o type="iri" val="http://es.dbpedia.org/resource/!!"/></data-triple-N3>

<data-triple-N3 id="e27357-1"><s type="iri" val="http://dbpedia.org/resource/!!"/><p type="iri" val="http://www.w3.org/2002/07/owl#sameAs"/><o type="iri" val="http://et.dbpedia.org/resource/!!"/></data-triple-N3>

<data-triple-N3 id="e27357-1"><s type="iri" val="http://dbpedia.org/resource/!!"/><p type="iri" val="http://www.w3.org/2002/07/owl#sameAs"/><o type="iri" val="http://fr.dbpedia.org/resource/!!"/></data-triple-N3>

<data-triple-N3 id="e27357-1"><s type="iri" val="http://dbpedia.org/resource/!!"/><p type="iri" val="http://www.w3.org/2002/07/owl#sameAs"/><o type="iri" val="http://it.dbpedia.org/resource/!!"/></data-triple-N3>

<data-triple-N3 id="e27357-1"><s type="iri" val="http://dbpedia.org/resource/!!"/><p type="iri" val="http://www.w3.org/2002/07/owl#sameAs"/><o type="iri" val="http://ko.dbpedia.org/resource/!!"/></data-triple-N3>

<data-triple-N3 id="e27357-1"><s type="iri" val="http://dbpedia.org/resource/!!"/><p type="iri" val="http://www.w3.org/2002/07/owl#sameAs"/><o type="iri" val="http://www.wikidata.org/entity/Q353153"/></data-triple-N3>

<data-triple-N3 id="e27357-1"><s type="iri" val="http://dbpedia.org/resource/!!"/><p type="iri" val="http://www.w3.org/2002/07/owl#sameAs"/><o type="iri" val="http://zh.dbpedia.org/resource/!!"/></data-triple-N3>

<data-triple-N3 id="e27357-1"><s type="iri" val="http://dbpedia.org/resource/!!"/><p type="iri" val="http://www.w3.org/ns/prov#wasDerivedFrom"/><o type="iri" val="http://en.wikipedia.org/wiki/!!?oldid=545017937"/></data-triple-N3>

<data-triple-N3 id="e27357-1"><s type="iri" val="http://dbpedia.org/resource/!!"/><p type="iri" val="http://xmlns.com/foaf/0.1/isPrimaryTopicOf"/><o type="iri" val="http://en.wikipedia.org/wiki/!!"/></data-triple-N3>